<?xml version="1.0" encoding="utf-8"?>
<xs:schema xmlns="http://www.uniovi.es" elementFormDefault="qualified" targetNamespace="http://www.uniovi.es" xmlns:xs="http://www.w3.org/2001/XMLSchema">

	
	<xs:simpleType name="coordenadaDMS">
		<xs:restriction base="xs:string">
			<xs:pattern value="\d{1,3}(\.\d{1,2}){1,2}"/>
		</xs:restriction>
	</xs:simpleType>
  
	<xs:element name="circuito">
		<xs:complexType>
			<xs:sequence>
				<xs:element ref="nombre" />
				<xs:element ref="longitudTotal" />
				<xs:element ref="anchura" />
				<xs:element ref="fecha" />
				<xs:element ref="hora" />
				<xs:element ref="vueltas" />
				<xs:element ref="localidad" />
				<xs:element ref="pais" />
				<xs:element ref="patrocinador" />
				<xs:element ref="referencias" />
				<xs:element ref="galeriaFotos" />
				<xs:element ref="galeriaVideos" />
				<xs:element ref="puntoOrigen" />
				<xs:element ref="tramos" />
				<xs:element ref="vencedor" />
				<xs:element ref="clasificacion" />
			</xs:sequence>
		</xs:complexType>
	</xs:element>
	<xs:element name="nombre" type="xs:string" />
	<xs:element name="longitudTotal">
		<xs:complexType>
			<xs:simpleContent>
				<xs:extension base="xs:decimal">
					<xs:attribute name="unidad" type="xs:string" use="required" />
				</xs:extension>
			</xs:simpleContent>
		</xs:complexType>
	</xs:element>
	<xs:element name="anchura">
		<xs:complexType>
			<xs:simpleContent>
				<xs:extension base="xs:decimal">
					<xs:attribute name="unidad" type="xs:string" use="required" />
				</xs:extension>
			</xs:simpleContent>
		</xs:complexType>
	</xs:element>
	<xs:element name="fecha" type="xs:date" />
	<xs:element name="hora" type="xs:time" />
	<xs:element name="vueltas" type="xs:integer" />
	<xs:element name="localidad" type="xs:string" />
	<xs:element name="pais" type="xs:string" />
	<xs:element name="patrocinador" type="xs:string" />
	<xs:element name="referencias">
		<xs:complexType>
			<xs:sequence>
				<xs:element minOccurs="1" maxOccurs="3" ref="referencia" />
			</xs:sequence>
		</xs:complexType>
	</xs:element>
	<xs:element name="referencia" type="xs:string" />
	<xs:element name="galeriaFotos">
		<xs:complexType>
			<xs:sequence>
				<xs:element minOccurs="1" maxOccurs="3" ref="foto" />
			</xs:sequence>
		</xs:complexType>
	</xs:element>
	<xs:element name="foto" type="xs:string" />
	<xs:element name="galeriaVideos">
		<xs:complexType>
			<xs:sequence>
				<xs:element minOccurs="1" maxOccurs="3" ref="video" />
			</xs:sequence>
		</xs:complexType>
	</xs:element>
	<xs:element name="video" type="xs:string" />
	<xs:element name="puntoOrigen">
		<xs:complexType>
			<xs:sequence>
				<xs:element ref="longitud" />
				<xs:element ref="latitud" />
				<xs:element ref="altitud" />
			</xs:sequence>
		</xs:complexType>
	</xs:element>
		<xs:element name="longitud">
		<xs:complexType>
			<xs:simpleContent>
				<xs:extension base="coordenadaDMS">
					<xs:attribute name="unidad" type="xs:string" use="required"/>
				</xs:extension>
			</xs:simpleContent>
		</xs:complexType>
	</xs:element>
	<xs:element name="latitud">
		<xs:complexType>
			<xs:simpleContent>
				<xs:extension base="coordenadaDMS">
					<xs:attribute name="unidad" type="xs:string" use="required"/>
				</xs:extension>
			</xs:simpleContent>
		</xs:complexType>
	</xs:element>
	<xs:element name="altitud">
		<xs:complexType>
			<xs:simpleContent>
				<xs:extension base="coordenadaDMS">
					<xs:attribute name="unidad" type="xs:string" use="required"/>
				</xs:extension>
			</xs:simpleContent>
		</xs:complexType>
	</xs:element>
	<xs:element name="tramos">
		<xs:complexType>
			<xs:sequence>
				<xs:element minOccurs="1" maxOccurs="unbounded" ref="tramo" />
			</xs:sequence>
		</xs:complexType>
	</xs:element>
	<xs:element name="tramo">
		<xs:complexType>
			<xs:sequence>
				<xs:element ref="coordenadas" />
				<xs:element ref="sector" />
			</xs:sequence>
			<xs:attribute name="distancia" type="xs:decimal" use="required" />
		</xs:complexType>
	</xs:element>
	<xs:element name="coordenadas">
		<xs:complexType>
			<xs:sequence>
				<xs:element ref="longitud" />
				<xs:element ref="latitud" />
				<xs:element ref="altitud" />
			</xs:sequence>
		</xs:complexType>
	</xs:element>
	<xs:element name="sector" type="xs:string" />
	<xs:element name="vencedor">
		<xs:complexType>
			<xs:sequence>
				<xs:element ref="nombre" />
				<xs:element ref="tiempo" />
			</xs:sequence>
		</xs:complexType>
	</xs:element>
	<xs:element name="tiempo" type="xs:time" />
	<xs:element name="clasificacion">
		<xs:complexType>
			<xs:sequence>
				<xs:element minOccurs="1" maxOccurs="unbounded" ref="piloto" />
			</xs:sequence>
		</xs:complexType>
	</xs:element>
	<xs:element name="piloto" type="xs:string" />
</xs:schema>